{
  "strand_id": "RS-IRS-EMANUEL-ARCHASTRO-0001",
  "strand_type": "IRS",
  "carrier": {
    "primary_carrier_id": "DE-EMANUEL-1989",
    "carrier_type": "individual",
    "additional_carriers": []
  },
  "motifs": [
    {
      "motif_id": "MOT-ARCH-001",
      "motif_name": "Orte als räumliche Verkörperung kollektiver Erinnerung",
      "description": "Archäoastronomische Orte werden als physische Manifestationen kollektiver Erinnerung und Wissenstraditionen wahrgenommen",
      "frequency": 0.8,
      "intensity": 0.9,
      "examples": [
        "Goseck als Beobachtungspunkt",
        "Newgrange als Wintersonnenwende-Alignement",
        "Stonehenge als komplexes Kalendersystem"
      ]
    },
    {
      "motif_id": "MOT-MEM-002",
      "motif_name": "Memory Resonance",
      "description": "Starke Resonanz mit dem Phänomen des Erinnerungsverlusts und -erhalts als kollektive Bruchlinie",
      "frequency": 0.7,
      "intensity": 0.9,
      "examples": [
        "Forschungsschwerpunkt auf kollektive Erinnerung",
        "Analyse von Bruchlinien in der Überlieferung",
        "Interesse an Transformationsmechanismen von Erinnerung"
      ]
    }
  ],
  "couplings": [
    {
      "coupling_id": "CPL-ARCH-001",
      "target_id": "knowledge/places/places_archaeoastronomy",
      "target_type": "module",
      "coupling_mode": "amplifies",
      "strength": 0.9,
      "description": "Der Strand verstärkt die Bedeutung archäoastronomischer Orte als räumliche Verkörperung kollektiver Erinnerung"
    },
    {
      "coupling_id": "CPL-ZG-001",
      "target_id": "zeitgeist_module/ZG-001-memory-loss",
      "target_type": "module",
      "coupling_mode": "echoes",
      "strength": 0.7,
      "description": "Der Strand spiegelt die Resonanz mit dem Phänomen des Erinnerungsverlusts wider"
    },
    {
      "coupling_id": "CPL-MUV-001",
      "target_id": "modules/mythos_und_verwaltung",
      "target_type": "module",
      "coupling_mode": "amplifies",
      "strength": 0.8,
      "description": "Tiefe Resonanz mit mythischen Narrativen und Verwaltungsstrukturen"
    },
    {
      "coupling_id": "CPL-BOL-002",
      "target_id": "BOL-CON-003",
      "target_type": "pattern",
      "coupling_mode": "amplifies",
      "strength": 0.9,
      "description": "Erkenntnis der Wiederkehr dieses Musters in verschiedenen Kontexten"
    }
  ],
  "evidence": [
    {
      "evidence_id": "EVID-ARCH-001",
      "evidence_type": "documented",
      "source": "DE-EMANUEL-1989.json: world_edges",
      "timestamp": "2026-01-22T00:00:00Z",
      "description": "Dokumentierte world_edges zeigen starke Resonanz mit archäoastronomischen Orten (EDGE-EMANUEL-001, strength: 0.9)"
    },
    {
      "evidence_id": "EVID-PERS-001",
      "evidence_type": "documented",
      "source": "DE-EMANUEL-1989.json: research_interests",
      "timestamp": "2026-01-22T00:00:00Z",
      "description": "Forschungsinteressen umfassen 'Kollektive Erinnerung', 'Archäoastronomie' und 'Anthropologische Muster'"
    },
    {
      "evidence_id": "EVID-PATT-001",
      "evidence_type": "documented",
      "source": "DE-EMANUEL-1989.json: resonance_patterns",
      "timestamp": "2026-01-22T00:00:00Z",
      "description": "Resonanzmuster BOL-CON-003 (Memory Resonance) mit Stärke 0.9 dokumentiert"
    }
  ],
  "time_window": {
    "start_year": 1989,
    "end_year": null,
    "era": "CE"
  },
  "metadata": {
    "created": "2026-01-25",
    "updated": "2026-01-25",
    "version": "1.0.0",
    "status": "active",
    "notes": "Erster IRS Strand für DE-EMANUEL-1989, basierend auf existierenden world_edges und resonance_patterns"
  }
}